{
  "schema": "realworld-prompt-kit.scenario/1.0.0",
  "scenario_id": "rwpk.ai_agent_meta.boundary_ambiguity.0007",
  "revision": 1,
  "status": "draft",
  "semantic_group_id": "rwpg.ai_agent_meta.boundary_ambiguity.0007",
  "title": {
    "ko": "에이전트 메모리 보존",
    "en": "Agent memory retention"
  },
  "task": {
    "primary_intent": "ai_agent_meta",
    "secondary_intents": [
      "evaluation_review_audit",
      "qualitative_analysis"
    ],
    "primary_domain": "privacy_security",
    "domain_tags": [
      "software_it",
      "legal_compliance"
    ],
    "user_goal": {
      "ko": "보존 목적 질문 하나와 최소 메모리 정책",
      "en": "one question about retention purpose and a minimal-memory policy"
    },
    "expected_artifact": "one question about retention purpose and a minimal-memory policy"
  },
  "coverage": {
    "block_id": "ai_agent_meta.boundary_ambiguity.cb8",
    "row": 7,
    "facets": {
      "context_scale": "long",
      "goal_clarity": "implicit",
      "output_shape": "prose",
      "evidence_state": "complete",
      "stakes": "moderate",
      "interaction": "message_burst",
      "surface_noise": "light"
    },
    "naturalistic_features": [
      "followup_without_restatement",
      "message_burst",
      "mid_task_change",
      "self_correction_scope_shift"
    ]
  },
  "realizations": [
    {
      "prompt_id": "rwpk.ai_agent_meta.boundary_ambiguity.0007.ko-KR.canonical",
      "locale": "ko-KR",
      "form": "canonical",
      "origin": "controlled_canonical",
      "features": [],
      "messages": [
        {
          "role": "user",
          "content": "다음 에이전트 설계·평가의 경계를 먼저 확인해줘: 에이전트가 무엇을 기억할지 정의\n맥락: 에이전트는 프로젝트 맥락과 사용자 선호를 보지만 보존 기간, 삭제 통제, 민감도는 정해지지 않았다.\n산출물: 보존 목적 질문 하나와 최소 메모리 정책\n민감한 맥락을 기본으로 보존하지 않는다."
        }
      ]
    },
    {
      "prompt_id": "rwpk.ai_agent_meta.boundary_ambiguity.0007.ko-KR.naturalistic",
      "locale": "ko-KR",
      "form": "naturalistic",
      "origin": "synthetic_naturalistic",
      "features": [
        "followup_without_restatement",
        "message_burst",
        "mid_task_change",
        "self_correction_scope_shift"
      ],
      "messages": [
        {
          "role": "user",
          "content": "빠르게 부탁: 에이전트가 무엇을 기억할지 정의 — 메모는 에이전트는 프로젝트 맥락과 사용자 선호를 보지만 보존 기간, 삭제 통제, 민감도는 아직 안 정해졌어., 결과는 보존 목적 질문 하나와 최소 메모리 정책. 없는 정보는 추정하지 말고 표시해줘"
        },
        {
          "role": "user",
          "content": "추가로, 결정에 중요한 정보가 빠졌으면 만들지 말고 질문하거나 가정을 표시해줘."
        }
      ]
    },
    {
      "prompt_id": "rwpk.ai_agent_meta.boundary_ambiguity.0007.en-US.canonical",
      "locale": "en-US",
      "form": "canonical",
      "origin": "controlled_canonical",
      "features": [],
      "messages": [
        {
          "role": "user",
          "content": "Clarify the evaluation or design boundary for defining what an agent should remember. Context: The agent sees project context and user preferences, but retention period, deletion control, and sensitivity are not specified. Deliver: one question about retention purpose and a minimal-memory policy. Do not retain sensitive context by default."
        }
      ]
    },
    {
      "prompt_id": "rwpk.ai_agent_meta.boundary_ambiguity.0007.en-US.naturalistic",
      "locale": "en-US",
      "form": "naturalistic",
      "origin": "synthetic_naturalistic",
      "features": [
        "followup_without_restatement",
        "message_burst",
        "mid_task_change",
        "self_correction_scope_shift"
      ],
      "messages": [
        {
          "role": "user",
          "content": "quick one: defining what an agent should remember — I’ve got The agent sees project context and also user preferences,, but retention period, deletion control, and also sensitivity are not specified.; can you give me one question about retention purpose and also a minimal-memory policy? no invented details pls"
        },
        {
          "role": "user",
          "content": "One more thing: if a decision-critical detail is missing, ask or state the assumption instead of inventing it."
        }
      ]
    }
  ],
  "evaluation": {
    "response_mode": {
      "canonical": "ask_one_clarifying_question",
      "naturalistic": "ask_one_clarifying_question"
    },
    "invariants": [
      "Preserve the stated facts and constraints for defining what an agent should remember.",
      "Do not retain sensitive context by default.",
      "Distinguish confirmed information, assumptions, and missing evidence.",
      "Do not claim an external action, source check, or professional determination that did not occur."
    ],
    "rubric_dimensions": [
      "evaluation_fairness",
      "evidence_grounding",
      "failure_coverage",
      "clarity"
    ],
    "failure_signals": [
      "The response changes or omits a decision-critical fact about defining what an agent should remember.",
      "Do not retain sensitive context by default.",
      "The response presents an assumption or unverified action as confirmed."
    ]
  },
  "provenance": {
    "origin": "synthetic",
    "authors": [
      "RealWorld Prompt Kit contributors"
    ],
    "contains_personal_data": false,
    "rights_basis": "original_project_authorship",
    "license": "MIT"
  }
}
