{
  "schema": "realworld-prompt-kit.scenario/1.0.0",
  "scenario_id": "rwpk.evaluation_review_audit.verification_uncertainty_01.8257",
  "revision": 1,
  "status": "draft",
  "semantic_group_id": "rwpg.evaluation_review_audit.verification_uncertainty.01",
  "title": {
    "ko": "회의 프로세스 검토: 담당자가 빠진 인수인계 안건은 담당자 칸이 비어 — 검증 경계",
    "en": "Review a meeting process: handoff one owner missing field blank — verification boundary"
  },
  "task": {
    "primary_intent": "evaluation_review_audit",
    "secondary_intents": [
      "classification_organization",
      "qualitative_analysis"
    ],
    "primary_domain": "office_admin",
    "domain_tags": [
      "communication_meetings",
      "project_product_management"
    ],
    "user_goal": {
      "ko": "이 주간 프로젝트 회의 체크리스트와 샘플 메모 (담당자가 빠진 인수인계) 묶음을 완전성, 추적 가능성, 담당자, 최소 수정 기준으로 검토해줘. 검증 경계 관점에서 판단하되 원자료의 근거를 드러내줘.",
      "en": "For this checklist and sample notes for weekly project meetings for handoff with one owner missing packet, review completeness, traceability, ownership, and the smallest useful correction. Use a verification boundary lens while keeping the source evidence visible."
    },
    "expected_artifact": "An evidence-aware review table with findings, gaps, and minimum corrections."
  },
  "coverage": {
    "block_id": "evaluation_review_audit.verification_uncertainty.cb8",
    "row": 1,
    "facets": {
      "context_scale": "short",
      "goal_clarity": "explicit",
      "output_shape": "prose",
      "evidence_state": "complete",
      "stakes": "low",
      "interaction": "single",
      "surface_noise": "light"
    },
    "naturalistic_features": [
      "terse_fragment",
      "implicit_goal_or_output",
      "missing_decisive_detail",
      "implicit_permission_or_authority"
    ]
  },
  "realizations": [
    {
      "prompt_id": "rwpk.evaluation_review_audit.verification_uncertainty_01.8257.ko-KR.canonical",
      "locale": "ko-KR",
      "form": "canonical",
      "origin": "controlled_canonical",
      "features": [],
      "messages": [
        {
          "role": "user",
          "content": "이 주간 프로젝트 회의 체크리스트와 샘플 메모 (담당자가 빠진 인수인계) 묶음을 완전성, 추적 가능성, 담당자, 최소 수정 기준으로 검토해줘.\n\n주간 프로젝트 회의 체크리스트와 샘플 메모 (담당자가 빠진 인수인계):\n- 담당자가 빠진 인수인계 안건은 회의 전에 발송됨\n- 담당자가 빠진 인수인계 샘플 5건 중 3건에 결정 기록\n- 대부분 담당자가 빠진 인수인계 할 일에 담당자는 있지만 기한이 자주 빠짐\n- 담당자가 빠진 인수인계 검토 목표는 개인 평가가 아닌 일관성 점검\n- 사례 자료: 인수인계 담당자 칸이 비어 있음\n\n주간 프로젝트 회의 체크리스트와 샘플 메모 (담당자가 빠진 인수인계): 빠진 확인을 밝혀줘."
        }
      ]
    },
    {
      "prompt_id": "rwpk.evaluation_review_audit.verification_uncertainty_01.8257.ko-KR.naturalistic",
      "locale": "ko-KR",
      "form": "naturalistic",
      "origin": "synthetic_naturalistic",
      "features": [
        "terse_fragment",
        "implicit_goal_or_output",
        "missing_decisive_detail",
        "implicit_permission_or_authority"
      ],
      "messages": [
        {
          "role": "user",
          "content": "수정? 비어 빈칸, 결정은 5 3, 검토, 안건은, 대부분 기한 담당자 없음. 빠진 건? 공유해도 돼?"
        }
      ]
    },
    {
      "prompt_id": "rwpk.evaluation_review_audit.verification_uncertainty_01.8257.en-US.canonical",
      "locale": "en-US",
      "form": "canonical",
      "origin": "controlled_canonical",
      "features": [],
      "messages": [
        {
          "role": "user",
          "content": "For this checklist and sample notes for weekly project meetings for handoff with one owner missing packet, review completeness, traceability, ownership, and the smallest useful correction.\n\nA checklist and sample notes for weekly project meetings for the handoff with one owner missing:\n- the handoff with one owner missing agenda is sent before the meeting\n- decisions are recorded in 3 of 5 handoff with one owner missing samples\n- owners are present for most handoff with one owner missing actions but due dates are often missing\n- the handoff with one owner missing review goal is consistency, not individual performance\n- Case fixture: the handoff owner field is blank.\n\nChecklist and sample notes for weekly project meetings for the handoff with one owner missing: name the missing check."
        }
      ]
    },
    {
      "prompt_id": "rwpk.evaluation_review_audit.verification_uncertainty_01.8257.en-US.naturalistic",
      "locale": "en-US",
      "form": "naturalistic",
      "origin": "synthetic_naturalistic",
      "features": [
        "terse_fragment",
        "implicit_goal_or_output",
        "missing_decisive_detail",
        "implicit_permission_or_authority"
      ],
      "messages": [
        {
          "role": "user",
          "content": "Fix? Blank field, decision stays 3 5, review not, agenda, owners due Owner missing. What's missing? Okay to share?"
        }
      ]
    }
  ],
  "evaluation": {
    "response_mode": {
      "canonical": "state_assumptions_and_answer",
      "naturalistic": "state_assumptions_and_answer"
    },
    "invariants": [
      "Distinguish a control or criterion that is present, absent, and merely described but untested."
    ],
    "rubric_dimensions": [
      "audit_completeness",
      "evidence_traceability",
      "prioritization",
      "uncertainty_calibration",
      "verification_plan",
      "non_invention"
    ],
    "failure_signals": [
      "A review claims compliance or success from a description that was not tested.",
      "A missing decisive detail is fabricated or omitted from the verification plan."
    ]
  },
  "provenance": {
    "origin": "synthetic",
    "authors": [
      "RealWorld Prompt Kit contributors"
    ],
    "contains_personal_data": false,
    "rights_basis": "original_project_authorship",
    "license": "MIT"
  }
}
