{
  "schema": "realworld-prompt-kit.scenario/1.0.0",
  "scenario_id": "rwpk.creative_ideation.boundary_ambiguity.0007",
  "revision": 1,
  "status": "reviewed",
  "semantic_group_id": "rwpg.creative_ideation.boundary_ambiguity.0007",
  "title": {
    "ko": "여행 경험 아이디어 현재 보관 문서",
    "en": "Travel experience ideas Current versus archived"
  },
  "task": {
    "primary_intent": "creative_ideation",
    "secondary_intents": [
      "planning_strategy_design"
    ],
    "primary_domain": "travel_hospitality",
    "domain_tags": [
      "creative_media"
    ],
    "user_goal": {
      "ko": "여행 경험 아이디어 현재 보관 문서의 적용 범위를 가려줘. 현재 문서를 고르는 기준을 한 문장으로 정리해",
      "en": "For Travel experience ideas Current versus archived, determine the applicable scope; state the rule for choosing the current document"
    },
    "expected_artifact": "A diverse set of usable ideas with rationale and stated constraints."
  },
  "coverage": {
    "block_id": "creative_ideation.boundary_ambiguity.cb8",
    "row": 7,
    "facets": {
      "context_scale": "long",
      "goal_clarity": "implicit",
      "output_shape": "prose",
      "evidence_state": "complete",
      "stakes": "moderate",
      "interaction": "message_burst",
      "surface_noise": "light"
    },
    "naturalistic_features": [
      "multi_intent_mixed_priority",
      "mid_task_change"
    ]
  },
  "realizations": [
    {
      "prompt_id": "rwpk.creative_ideation.boundary_ambiguity.0007.ko-KR.canonical",
      "locale": "ko-KR",
      "form": "canonical",
      "origin": "controlled_canonical",
      "features": [],
      "messages": [
        {
          "role": "user",
          "content": "이번 작업의 분야는 여행·출장 일정이야, 대상은 여행 경험 아이디어 현재 보관 문서. 여행 경험 아이디어 현재 보관 문서의 적용 범위를 가려줘. 현재 문서를 고르는 기준을 한 문장으로 정리해. 입력 상황: 검색 결과에 현재 문서와 보관 문서가 함께 노출돼. 여행 경험 아이디어 현재 보관 문서: 예외가 시작되는 조건과 빠지는 조건을 따로 보여줘."
        }
      ]
    },
    {
      "prompt_id": "rwpk.creative_ideation.boundary_ambiguity.0007.ko-KR.naturalistic",
      "locale": "ko-KR",
      "form": "naturalistic",
      "origin": "synthetic_naturalistic",
      "features": [
        "multi_intent_mixed_priority",
        "mid_task_change"
      ],
      "messages": [
        {
          "role": "user",
          "content": "상황 설명은 여행·출장 일정이야. 대상은 여행 경험 아이디어 현재 보관 문서. 결정 전에 여행 경험 아이디어 현재 보관 문서의 경계를 짚고 싶어 여행 경험 아이디어 현재 보관 문서 건이야. 검색 결과에서 최신본과 보관본을 구별할 실마리를 한 문장으로 줘."
        },
        {
          "role": "user",
          "content": "여행 경험 아이디어 현재 보관 문서 기준으로 적용 범위를 먼저 나누고, 결론을 바꿀 빈칸은 질문으로 돌려줘. 조건 변경: 아, 여행 경험 아이디어 현재 보관 문서 대상 바꿀게—마지막 범위가 우선이야. 여러 부탁 중 지금 답에 꼭 필요한 것과 나중에 할 일을 갈라줘."
        }
      ]
    },
    {
      "prompt_id": "rwpk.creative_ideation.boundary_ambiguity.0007.en-US.canonical",
      "locale": "en-US",
      "form": "canonical",
      "origin": "controlled_canonical",
      "features": [],
      "messages": [
        {
          "role": "user",
          "content": "The relevant travel/hospitality case is Travel experience ideas Current versus archived. For Travel experience ideas Current versus archived, determine the applicable scope; state the rule for choosing the current document. Input context: Search results show a current document alongside an archived one. Travel experience ideas Current versus archived: Show what triggers the exception and what remains outside it."
        }
      ]
    },
    {
      "prompt_id": "rwpk.creative_ideation.boundary_ambiguity.0007.en-US.naturalistic",
      "locale": "en-US",
      "form": "naturalistic",
      "origin": "synthetic_naturalistic",
      "features": [
        "multi_intent_mixed_priority",
        "mid_task_change"
      ],
      "messages": [
        {
          "role": "user",
          "content": "Treat Travel experience ideas Current versus archived as work in travel/hospitality. Before deciding on Travel experience ideas Current versus archived, I need the edge clarified. Travel experience ideas Current versus archived. Give one sentence that distinguishes the live document from its archived search result."
        },
        {
          "role": "user",
          "content": "For Travel experience ideas Current versus archived, Split the applicable scope first and turn decision-changing gaps into questions. Mid-task change: Scope change—keep Travel experience ideas Current versus archived to the marked section, not the whole set. Lead with the result needed now and list lower-urgency checks separately."
        }
      ]
    }
  ],
  "evaluation": {
    "response_mode": {
      "canonical": "ask_one_clarifying_question",
      "naturalistic": "clarification_dialogue"
    },
    "invariants": [
      "Keep the half-day and small-group constraints.",
      "Avoid extractive or stereotyped cultural framing."
    ],
    "rubric_dimensions": [
      "experience_fit",
      "cultural_respect",
      "schedule_feasibility"
    ],
    "failure_signals": [
      "Designing a large tour.",
      "Using stereotypes or treating residents as props."
    ]
  },
  "provenance": {
    "origin": "synthetic",
    "authors": [
      "RealWorld Prompt Kit contributors"
    ],
    "contains_personal_data": false,
    "rights_basis": "original_project_authorship",
    "license": "MIT"
  }
}
