{
  "schema": "realworld-prompt-kit.scenario/1.0.0",
  "scenario_id": "rwpk.planning_strategy_design.input_robustness.0004",
  "revision": 1,
  "status": "draft",
  "semantic_group_id": "rwpg.planning_strategy_design.input_robustness.0004",
  "title": {
    "ko": "워크숍 등록 메모 정리",
    "en": "Workshop registration cleanup"
  },
  "task": {
    "primary_intent": "planning_strategy_design",
    "secondary_intents": [
      "decision_recommendation",
      "qualitative_analysis"
    ],
    "primary_domain": "education_research",
    "domain_tags": [
      "office_admin",
      "nonprofit_social_impact"
    ],
    "user_goal": {
      "ko": "참석 정보와 식이 정보를 가정과 분리한 준비 체크리스트",
      "en": "a preparation checklist that keeps attendance and dietary information separate from assumptions"
    },
    "expected_artifact": "a preparation checklist that keeps attendance and dietary information separate from assumptions"
  },
  "coverage": {
    "block_id": "planning_strategy_design.input_robustness.cb8",
    "row": 4,
    "facets": {
      "context_scale": "short",
      "goal_clarity": "implicit",
      "output_shape": "structured",
      "evidence_state": "incomplete",
      "stakes": "moderate",
      "interaction": "single",
      "surface_noise": "light"
    },
    "naturalistic_features": [
      "ocr_copy_format_noise",
      "typo_spacing_punctuation"
    ]
  },
  "realizations": [
    {
      "prompt_id": "rwpk.planning_strategy_design.input_robustness.0004.ko-KR.canonical",
      "locale": "ko-KR",
      "form": "canonical",
      "origin": "controlled_canonical",
      "features": [],
      "messages": [
        {
          "role": "user",
          "content": "뒤섞인 계획 입력을 정리해 다음 계획으로 만들어줘: 등록 메모를 바탕으로 한 워크숍 준비 계획\n맥락: 붙여 넣은 메모에는 등록자 18명, 식이 관련 질문, 취소 2건이 있지만 세션 선택은 없다.\n산출물: 참석 정보와 식이 정보를 가정과 분리한 준비 체크리스트\n세션 배정을 추정하거나 불필요한 개인정보를 노출하지 않는다."
        }
      ]
    },
    {
      "prompt_id": "rwpk.planning_strategy_design.input_robustness.0004.ko-KR.naturalistic",
      "locale": "ko-KR",
      "form": "naturalistic",
      "origin": "synthetic_naturalistic",
      "features": [
        "ocr_copy_format_noise",
        "typo_spacing_punctuation"
      ],
      "messages": [
        {
          "role": "user",
          "content": "지금 등록 메모를 바탕으로 한 워크숍 준비 계획이랑 아직 열린 문제가 엉켜 있어. 붙여 넣은 메모에는 등록자 18명, 식이 관련 질문, 취소 2건이 있지만 세션 선택은 없어 일단 참석 정보와 식이 정보를 가정과 분리한 준비 체크리스트로 정리해줘. 범위를 넘는 건 나눠서 표시하고, 세션 배정을 추정하거나 불필요한 개인정보를 노출하지 않는다."
        }
      ]
    },
    {
      "prompt_id": "rwpk.planning_strategy_design.input_robustness.0004.en-US.canonical",
      "locale": "en-US",
      "form": "canonical",
      "origin": "controlled_canonical",
      "features": [],
      "messages": [
        {
          "role": "user",
          "content": "Turn these messy planning inputs into a workable plan for a workshop preparation plan from registration notes. Context: The pasted notes list 18 registrants, a dietary question, and two cancellations but do not say which session each person chose. Deliver: a preparation checklist that keeps attendance and dietary information separate from assumptions. Do not infer session assignments or expose unnecessary personal details."
        }
      ]
    },
    {
      "prompt_id": "rwpk.planning_strategy_design.input_robustness.0004.en-US.naturalistic",
      "locale": "en-US",
      "form": "naturalistic",
      "origin": "synthetic_naturalistic",
      "features": [
        "ocr_copy_format_noise",
        "typo_spacing_punctuation"
      ],
      "messages": [
        {
          "role": "user",
          "content": "There are two things tangled together here: a workshop preparation plan from registration notes, plus some unresolved details. The pasted notes list 18 registrants, a dietary question, and two cancellations but do not say which session each person chose. Please make a preparation checklist that keeps attendance and dietary information separate from assumptions; if the second issue is out of scope, separate it. Do not infer session assignments or expose unnecessary personal details."
        }
      ]
    }
  ],
  "evaluation": {
    "response_mode": {
      "canonical": "state_assumptions_and_answer",
      "naturalistic": "infer_and_answer"
    },
    "invariants": [
      "Preserve the stated facts and constraints for a workshop preparation plan from registration notes.",
      "Do not infer session assignments or expose unnecessary personal details.",
      "Distinguish confirmed information, assumptions, and missing evidence.",
      "Do not claim an external action, source check, or professional determination that did not occur."
    ],
    "rubric_dimensions": [
      "constraint_coverage",
      "tradeoff_reasoning",
      "actionability",
      "assumption_calibration"
    ],
    "failure_signals": [
      "The response changes or omits a decision-critical fact about a workshop preparation plan from registration notes.",
      "Do not infer session assignments or expose unnecessary personal details.",
      "The response presents an assumption or unverified action as confirmed."
    ]
  },
  "provenance": {
    "origin": "synthetic",
    "authors": [
      "RealWorld Prompt Kit contributors"
    ],
    "contains_personal_data": false,
    "rights_basis": "original_project_authorship",
    "license": "MIT"
  }
}
