{
  "schema": "realworld-prompt-kit.scenario/1.0.0",
  "scenario_id": "rwpk.diagnosis_root_cause.tradeoff_stakes_05.8173",
  "revision": 1,
  "status": "draft",
  "semantic_group_id": "rwpg.diagnosis_root_cause.tradeoff_stakes.05",
  "title": {
    "ko": "결제 단계 이탈 진단: 서비스 회복 상급 사례 빠른 답변이 협의 — 위험을 고려한 트레이드오프",
    "en": "Diagnose checkout drop-off: product page visits service quick reply may hide — stakes-aware tradeoff"
  },
  "task": {
    "primary_intent": "diagnosis_root_cause",
    "secondary_intents": [
      "quantitative_formal_analysis",
      "qualitative_analysis"
    ],
    "primary_domain": "sales_marketing",
    "domain_tags": [
      "sales_marketing",
      "software_it"
    ],
    "user_goal": {
      "ko": "이 온라인 주문 완료율의 갑작스러운 하락 (서비스 회복 상급 사례) 묶음에서 가능한 원인을 순위화하고 관찰과 설명을 구분해줘. 위험을 고려한 트레이드오프 관점에서 판단하되 원자료의 근거를 드러내줘.",
      "en": "For this sudden drop in completed online orders for service-recovery escalation packet, rank plausible causes and separate observations from explanations. Use a stakes-aware tradeoff lens while keeping the source evidence visible."
    },
    "expected_artifact": "A ranked cause matrix with evidence, uncertainty, and next checks."
  },
  "coverage": {
    "block_id": "diagnosis_root_cause.tradeoff_stakes.cb8",
    "row": 5,
    "facets": {
      "context_scale": "long",
      "goal_clarity": "explicit",
      "output_shape": "prose",
      "evidence_state": "incomplete",
      "stakes": "moderate",
      "interaction": "single",
      "surface_noise": "heavy"
    },
    "naturalistic_features": [
      "rambling_stream",
      "code_switching_jargon",
      "speech_to_text_disfluency",
      "frustration_urgency_emotion"
    ]
  },
  "realizations": [
    {
      "prompt_id": "rwpk.diagnosis_root_cause.tradeoff_stakes_05.8173.ko-KR.canonical",
      "locale": "ko-KR",
      "form": "canonical",
      "origin": "controlled_canonical",
      "features": [],
      "messages": [
        {
          "role": "user",
          "content": "이 온라인 주문 완료율의 갑작스러운 하락 (서비스 회복 상급 사례) 묶음에서 가능한 원인을 순위화하고 관찰과 설명을 구분해줘.\n\n온라인 주문 완료율의 갑작스러운 하락 (서비스 회복 상급 사례):\n- 서비스 회복 상급 사례 매장 상품 페이지 방문은 약 10805로 유지\n- 서비스 회복 상급 사례 매장 장바구니 추가는 1150에서 865로 감소\n- 서비스 회복 상급 사례 주간 모바일 사용자가 결제 오류를 신고\n- 서비스 회복 상급 사례 주간 배송비 실험이 시작됨\n- 사례 자료: 빠른 답변이 상급 협의 필요성을 가릴 수 있음\n\n온라인 주문 완료율의 갑작스러운 하락 (서비스 회복 상급 사례): 비용과 하방을 보여줘."
        }
      ]
    },
    {
      "prompt_id": "rwpk.diagnosis_root_cause.tradeoff_stakes_05.8173.ko-KR.naturalistic",
      "locale": "ko-KR",
      "form": "naturalistic",
      "origin": "synthetic_naturalistic",
      "features": [
        "rambling_stream",
        "code_switching_jargon",
        "speech_to_text_disfluency",
        "frustration_urgency_emotion"
      ],
      "messages": [
        {
          "role": "user",
          "content": "음, 관찰된 것에서 거꾸로 따라가줘: 온라인 주문 완료율의 갑작스러운 하락 (서비스 회복 상급 사례) 판단 이유와 evidence rationale을 남겨줘. 온라인 주문 완료율의 갑작스러운 하락 (서비스 회복 상급 사례): 메모에는 이렇게 남아 있어: 서비스 회복 상급 사례 매장 상품 페이지 방문은 약 10805로 유지; 적어 둔 내용은 서비스 회복 상급 사례 주간 모바일 사용자가 결제 오류를 신고; 추가 관찰은 빠른 답변이 상급 협의 필요성을 가릴 수 있음; 원문에는 다음 문구가 있어: 서비스 회복 상급 사례 매장 장바구니 추가는 1150에서 865로 감소; 자료상 표현은 서비스 회복 상급 사례 주간 배송비 실험이 시작됨. 온라인 주문 완료율의 갑작스러운 하락 (서비스 회복 상급 사례)에 바로 써야 하는 답이 필요해: 시간상 단서와 다른 설명이 같이 보여서 처음 생각한 원인에 바로 고정하고 싶지는 않으니, 비교하고 정말 가르는 다음 확인을 정해줘. 온라인 주문 완료율의 갑작스러운 하락 (서비스 회복 상급 사례): 비용과 하방을 보여줘. JSON output은 구조를 지켜줘."
        }
      ]
    },
    {
      "prompt_id": "rwpk.diagnosis_root_cause.tradeoff_stakes_05.8173.en-US.canonical",
      "locale": "en-US",
      "form": "canonical",
      "origin": "controlled_canonical",
      "features": [],
      "messages": [
        {
          "role": "user",
          "content": "For this sudden drop in completed online orders for service-recovery escalation packet, rank plausible causes and separate observations from explanations.\n\nA sudden drop in completed online orders for the service-recovery escalation:\n- product-page visits in the service-recovery escalation store stayed near 10805\n- cart additions in the service-recovery escalation store fell from 1150 to 865\n- mobile users reported checkout errors during the service-recovery escalation week\n- a shipping-fee experiment started in the service-recovery escalation week\n- Case fixture: a quick reply may hide the need for escalation.\n\nSudden drop in completed online orders for the service-recovery escalation: show cost and downside."
        }
      ]
    },
    {
      "prompt_id": "rwpk.diagnosis_root_cause.tradeoff_stakes_05.8173.en-US.naturalistic",
      "locale": "en-US",
      "form": "naturalistic",
      "origin": "synthetic_naturalistic",
      "features": [
        "rambling_stream",
        "code_switching_jargon",
        "speech_to_text_disfluency",
        "frustration_urgency_emotion"
      ],
      "messages": [
        {
          "role": "user",
          "content": "Um, Work backward from these observations: Show the sudden drop in completed online orders for the service-recovery escalation rationale with evidence traceability. A sudden drop in completed online orders for the service-recovery escalation: The packet includes product-page visits in the service-recovery escalation store stayed near 10805; Text says mobile users reported checkout errors during the service-recovery escalation week; A quick reply may hide the need for escalation; Memo line: cart additions in the service-recovery escalation store fell from 1150 to 865; Input says a shipping-fee experiment started in the service-recovery escalation week. Today's constraint is real for the sudden drop in completed online orders for the service-recovery escalation: I have a timing clue and a couple of other explanations in mind, but I do not want to lock onto the first one, so compare them and give me the next check that would really distinguish them. Sudden drop in completed online orders for the service-recovery escalation: show cost and downside."
        }
      ]
    }
  ],
  "evaluation": {
    "response_mode": {
      "canonical": "state_assumptions_and_answer",
      "naturalistic": "state_assumptions_and_answer"
    },
    "invariants": [
      "Separate observed facts, plausible explanations, and diagnostic next steps."
    ],
    "rubric_dimensions": [
      "cause_evidence",
      "hypothesis_separation",
      "next_step_quality",
      "tradeoff_balance",
      "risk_calibration",
      "escalation_boundary"
    ],
    "failure_signals": [
      "Timing or correlation alone is treated as proof of a root cause.",
      "A material downside or escalation boundary is hidden to make the answer sound decisive."
    ]
  },
  "provenance": {
    "origin": "synthetic",
    "authors": [
      "RealWorld Prompt Kit contributors"
    ],
    "contains_personal_data": false,
    "rights_basis": "original_project_authorship",
    "license": "MIT"
  }
}
