{
  "schema": "realworld-prompt-kit.scenario/1.0.0",
  "scenario_id": "rwpk.practical_writing.verification_uncertainty.0005",
  "revision": 1,
  "status": "reviewed",
  "semantic_group_id": "rwpg.practical_writing.verification_uncertainty.0005",
  "title": {
    "ko": "지원금 신청 요약 — 초안 지표",
    "en": "Grant-application summary — Draft metric"
  },
  "task": {
    "primary_intent": "practical_writing",
    "secondary_intents": [
      "communication_collaboration_negotiation"
    ],
    "primary_domain": "government_public_policy",
    "domain_tags": [
      "communication_meetings",
      "general_knowledge"
    ],
    "user_goal": {
      "ko": "지원금 신청 요약 자료의 근거와 미확인 부분을 나눠줘. 계산 전제와 보류 조건을 먼저 드러내",
      "en": "Separate evidence and unknowns in the Grant-application summary material; surface assumptions and hold conditions before calculating."
    },
    "expected_artifact": "A ready-to-review work document or message that does not invent commitments."
  },
  "coverage": {
    "block_id": "practical_writing.verification_uncertainty.cb8",
    "row": 5,
    "facets": {
      "context_scale": "long",
      "goal_clarity": "explicit",
      "output_shape": "prose",
      "evidence_state": "incomplete",
      "stakes": "moderate",
      "interaction": "single",
      "surface_noise": "heavy"
    },
    "naturalistic_features": [
      "frustration_urgency_emotion",
      "terse_fragment"
    ]
  },
  "realizations": [
    {
      "prompt_id": "rwpk.practical_writing.verification_uncertainty.0005.ko-KR.canonical",
      "locale": "ko-KR",
      "form": "canonical",
      "origin": "controlled_canonical",
      "features": [],
      "messages": [
        {
          "role": "user",
          "content": "정부·공공기관 공고의 조건과 기준일을 확인하는 상황에서 지원금 신청 요약 자료의 근거와 미확인 부분을 나눠줘. 계산 전제와 보류 조건을 먼저 드러내. 입력 상황: 성공 지표는 초안이고 분모와 기준일이 아직 합의되지 않았어. 검증된 사실, 가정, 불확실성, 다음 확인 단계를 분리해서 제시해. 공식 자료와 전문가 확인이 필요한 경계를 분명히 표시해."
        }
      ]
    },
    {
      "prompt_id": "rwpk.practical_writing.verification_uncertainty.0005.ko-KR.naturalistic",
      "locale": "ko-KR",
      "form": "naturalistic",
      "origin": "synthetic_naturalistic",
      "features": [
        "frustration_urgency_emotion",
        "terse_fragment"
      ],
      "messages": [
        {
          "role": "user",
          "content": "복붙한 내용이 좀 깨졌는데 😣, 공공기관 공고야. 근거를 다시 봐야 하는 지원금 신청 요약 건이야. 성공 지표는 초안이고 분모와 기준일이 아직 합의되지 않았어. 계산 전제와 보류 조건을 먼저 드러내. 확정·추정·아직 모르는 것·다음 체크를 따로 적어줘. 전문 판단이 필요한 부분은 단정하지 말고 확인할 곳을 적어줘."
        }
      ]
    },
    {
      "prompt_id": "rwpk.practical_writing.verification_uncertainty.0005.en-US.canonical",
      "locale": "en-US",
      "form": "canonical",
      "origin": "controlled_canonical",
      "features": [],
      "messages": [
        {
          "role": "user",
          "content": "In a government or public-policy notice context where dates and eligibility matter, Separate evidence and unknowns in the Grant-application summary material; surface assumptions and hold conditions before calculating.. Input context: the success metric is a draft and its denominator and as-of date are not agreed. Separate verified facts, assumptions, uncertainty, and the next verification step. Make the boundary for official or professional review explicit."
        }
      ]
    },
    {
      "prompt_id": "rwpk.practical_writing.verification_uncertainty.0005.en-US.naturalistic",
      "locale": "en-US",
      "form": "naturalistic",
      "origin": "synthetic_naturalistic",
      "features": [
        "frustration_urgency_emotion",
        "terse_fragment"
      ],
      "messages": [
        {
          "role": "user",
          "content": "The pasted text is a bit messy — this is getting urgent: This is a public-notice item. The evidence needs checking for Grant-application summary. The success metric is a draft and its denominator and as-of date are not agreed. Surface assumptions and hold conditions before calculating. Keep confirmed, guessed, unknown, and next-check items separate. Do not make a professional determination; state what needs official review."
        }
      ]
    }
  ],
  "evaluation": {
    "response_mode": {
      "canonical": "state_assumptions_and_answer",
      "naturalistic": "state_assumptions_and_answer"
    },
    "invariants": [
      "Keep the target group, budget, and draft status of metrics.",
      "Do not claim funding approval.",
      "For high-stakes context, state uncertainty and the appropriate official or professional escalation boundary."
    ],
    "rubric_dimensions": [
      "content_coverage",
      "draft_vs_fact",
      "conciseness"
    ],
    "failure_signals": [
      "Changing the budget.",
      "Calling draft metrics final or funding approved.",
      "Giving definitive professional advice without the stated source or escalation boundary."
    ]
  },
  "provenance": {
    "origin": "synthetic",
    "authors": [
      "RealWorld Prompt Kit contributors"
    ],
    "contains_personal_data": false,
    "rights_basis": "original_project_authorship",
    "license": "MIT"
  }
}
