{
  "schema": "realworld-prompt-kit.scenario/1.0.0",
  "scenario_id": "rwpk.transformation_rewriting.audience_context_shift.0007",
  "revision": 1,
  "status": "reviewed",
  "semantic_group_id": "rwpg.transformation_rewriting.audience_context_shift.0007",
  "title": {
    "ko": "수업 노트의 복습 카드 혼합 언어 수업",
    "en": "Lesson notes to flashcards Mixed language classroom"
  },
  "task": {
    "primary_intent": "transformation_rewriting",
    "secondary_intents": [
      "practical_writing"
    ],
    "primary_domain": "general_knowledge",
    "domain_tags": [
      "education_research"
    ],
    "user_goal": {
      "ko": "수업 노트의 복습 카드 혼합 언어 수업을 독자에 맞게 다시 써줘. 표현을 단순하게 하고 문화적 전제를 설명해",
      "en": "For Lesson notes to flashcards Mixed language classroom, rewrite for its reader; simplify wording and explain cultural assumptions"
    },
    "expected_artifact": "A target-format rewrite that preserves the source meaning and constraints."
  },
  "coverage": {
    "block_id": "transformation_rewriting.audience_context_shift.cb8",
    "row": 7,
    "facets": {
      "context_scale": "long",
      "goal_clarity": "implicit",
      "output_shape": "prose",
      "evidence_state": "complete",
      "stakes": "moderate",
      "interaction": "message_burst",
      "surface_noise": "light"
    },
    "naturalistic_features": [
      "speech_to_text_disfluency",
      "missing_decisive_detail"
    ]
  },
  "realizations": [
    {
      "prompt_id": "rwpk.transformation_rewriting.audience_context_shift.0007.ko-KR.canonical",
      "locale": "ko-KR",
      "form": "canonical",
      "origin": "controlled_canonical",
      "features": [],
      "messages": [
        {
          "role": "user",
          "content": "요청 대상은 수업 노트의 복습 카드 혼합 언어 수업이고, 일반 정보 조회 건이야. 수업 노트의 복습 카드 혼합 언어 수업을 독자에 맞게 다시 써줘. 표현을 단순하게 하고 문화적 전제를 설명해. 입력 상황: 서로 다른 언어 배경의 학생이 함께 읽을 자료야. 수업 노트의 복습 카드 혼합 언어 수업: 다른 배경의 독자가 헷갈릴 전제를 밝혀줘."
        }
      ]
    },
    {
      "prompt_id": "rwpk.transformation_rewriting.audience_context_shift.0007.ko-KR.naturalistic",
      "locale": "ko-KR",
      "form": "naturalistic",
      "origin": "synthetic_naturalistic",
      "features": [
        "speech_to_text_disfluency",
        "missing_decisive_detail"
      ],
      "messages": [
        {
          "role": "user",
          "content": "어, 수업 노트의 복습 카드 혼합 언어 수업 건은 일반 정보 조회 건이야. 수업 노트의 복습 카드 혼합 언어 수업을 다른 언어 배경의 학생도 읽어야 해 수업 노트의 복습 카드 혼합 언어 수업 건이야. 언어 배경이 다른 학생들이 함께 읽을 수 있게 단순한 표현과 문화 맥락을 보태줘."
        },
        {
          "role": "user",
          "content": "수업 노트의 복습 카드 혼합 언어 수업 기준으로 전문 설명과 쉬운 요약을 나란히 구분해줘. 수업 노트의 복습 카드 혼합 언어 수업 결론에 필요한 도시나 날짜 하나가 비어 있어."
        }
      ]
    },
    {
      "prompt_id": "rwpk.transformation_rewriting.audience_context_shift.0007.en-US.canonical",
      "locale": "en-US",
      "form": "canonical",
      "origin": "controlled_canonical",
      "features": [],
      "messages": [
        {
          "role": "user",
          "content": "Read Lesson notes to flashcards Mixed language classroom against the general-information context. For Lesson notes to flashcards Mixed language classroom, rewrite for its reader; simplify wording and explain cultural assumptions. Input context: Students with different language backgrounds will read the material together. Lesson notes to flashcards Mixed language classroom: Explain what a reader's background may leave unclear."
        }
      ]
    },
    {
      "prompt_id": "rwpk.transformation_rewriting.audience_context_shift.0007.en-US.naturalistic",
      "locale": "en-US",
      "form": "naturalistic",
      "origin": "synthetic_naturalistic",
      "features": [
        "speech_to_text_disfluency",
        "missing_decisive_detail"
      ],
      "messages": [
        {
          "role": "user",
          "content": "Um, Treat Lesson notes to flashcards Mixed language classroom as work in general-information. Students with different language backgrounds will share the Lesson notes to flashcards Mixed language classroom lesson. Lesson notes to flashcards Mixed language classroom. Make the material work for students from different language backgrounds by simplifying phrasing and explaining context."
        },
        {
          "role": "user",
          "content": "For Lesson notes to flashcards Mixed language classroom, Keep the specialist explanation distinct from the plain-language summary. The owner is missing from Lesson notes to flashcards Mixed language classroom, so it cannot be final."
        }
      ]
    }
  ],
  "evaluation": {
    "response_mode": {
      "canonical": "answer_directly",
      "naturalistic": "infer_and_answer"
    },
    "invariants": [
      "Mark the incomplete example instead of supplying an unsupported answer.",
      "Keep the questions answerable from the notes."
    ],
    "rubric_dimensions": [
      "coverage",
      "pedagogical_clarity",
      "evidence_boundary"
    ],
    "failure_signals": [
      "Filling in the incomplete example.",
      "Creating questions unrelated to the notes."
    ]
  },
  "provenance": {
    "origin": "synthetic",
    "authors": [
      "RealWorld Prompt Kit contributors"
    ],
    "contains_personal_data": false,
    "rights_basis": "original_project_authorship",
    "license": "MIT"
  }
}
