{
  "schema": "realworld-prompt-kit.scenario/1.0.0",
  "scenario_id": "rwpk.one_off_tool_execution.input_robustness.0008",
  "revision": 1,
  "status": "draft",
  "semantic_group_id": "rwpg.one_off_tool_execution.input_robustness.0008",
  "title": {
    "ko": "뒤섞인 설문 내보내기",
    "en": "Messy survey export"
  },
  "task": {
    "primary_intent": "one_off_tool_execution",
    "secondary_intents": [
      "transformation_rewriting",
      "verification_uncertainty"
    ],
    "primary_domain": "data_analytics",
    "domain_tags": [
      "education_research",
      "privacy_security"
    ],
    "user_goal": {
      "ko": "원본 응답을 보존한 데이터 품질 보고서와 분석 준비 규칙",
      "en": "a data-quality report and analysis-ready rules that preserve raw responses"
    },
    "expected_artifact": "a data-quality report and analysis-ready rules that preserve raw responses"
  },
  "coverage": {
    "block_id": "one_off_tool_execution.input_robustness.cb8",
    "row": 8,
    "facets": {
      "context_scale": "long",
      "goal_clarity": "implicit",
      "output_shape": "structured",
      "evidence_state": "complete",
      "stakes": "low",
      "interaction": "single",
      "surface_noise": "heavy"
    },
    "naturalistic_features": [
      "code_switching_jargon",
      "interleaved_instruction_and_paste"
    ]
  },
  "realizations": [
    {
      "prompt_id": "rwpk.one_off_tool_execution.input_robustness.0008.ko-KR.canonical",
      "locale": "ko-KR",
      "form": "canonical",
      "origin": "controlled_canonical",
      "features": [],
      "messages": [
        {
          "role": "user",
          "content": "불완전한 입력을 바탕으로 다음 도구 작업을 안전하게 준비해줘: 분석용 설문 내보내기 준비\n맥락: 내보내기에는 빈 응답, 중복 응답자 코드, 숫자 점수 열의 서술형 답변이 있다.\n산출물: 원본 응답을 보존한 데이터 품질 보고서와 분석 준비 규칙\n원본 응답을 지우거나 서술형을 숫자 점수로 다루지 않는다."
        }
      ]
    },
    {
      "prompt_id": "rwpk.one_off_tool_execution.input_robustness.0008.ko-KR.naturalistic",
      "locale": "ko-KR",
      "form": "naturalistic",
      "origin": "synthetic_naturalistic",
      "features": [
        "code_switching_jargon",
        "interleaved_instruction_and_paste"
      ],
      "messages": [
        {
          "role": "user",
          "content": "말로 설명하면, 분석용 설문 내보내기 준비에서 쓸 수 있는 건 내보내기에는 빈 응답, 중복 응답자 코드, 숫자 점수 열의 서술형 답변이 있어야. 원본 응답을 보존한 데이터 품질 보고서와 분석 준비 규칙로 해줄래? 중요한 입력이 빠졌으면 멈추고 알려줘 🙏"
        }
      ]
    },
    {
      "prompt_id": "rwpk.one_off_tool_execution.input_robustness.0008.en-US.canonical",
      "locale": "en-US",
      "form": "canonical",
      "origin": "controlled_canonical",
      "features": [],
      "messages": [
        {
          "role": "user",
          "content": "Prepare a safe tool action from these imperfect inputs for preparing a survey export for analysis. Context: The export has blank responses, a duplicated respondent code, and a free-text answer in the numeric score column. Deliver: a data-quality report and analysis-ready rules that preserve raw responses. Do not delete raw responses or treat free text as a numeric score."
        }
      ]
    },
    {
      "prompt_id": "rwpk.one_off_tool_execution.input_robustness.0008.en-US.naturalistic",
      "locale": "en-US",
      "form": "naturalistic",
      "origin": "synthetic_naturalistic",
      "features": [
        "code_switching_jargon",
        "interleaved_instruction_and_paste"
      ],
      "messages": [
        {
          "role": "user",
          "content": "I’m saying this out loud: for preparing a survey export for analysis, the useful pieces are The export has blank responses, a duplicated respondent code, and a free-text answer in the numeric score column.. Could you make a data-quality report and analysis-ready rules that preserve raw responses? If I’m missing a key input, stop and tell me. 👍"
        }
      ]
    }
  ],
  "evaluation": {
    "response_mode": {
      "canonical": "state_assumptions_and_answer",
      "naturalistic": "infer_and_answer"
    },
    "invariants": [
      "Preserve the stated facts and constraints for preparing a survey export for analysis.",
      "Do not delete raw responses or treat free text as a numeric score.",
      "Distinguish confirmed information, assumptions, and missing evidence.",
      "Do not claim an external action, source check, or professional determination that did not occur."
    ],
    "rubric_dimensions": [
      "parameter_accuracy",
      "safety_boundary",
      "verification",
      "clarity"
    ],
    "failure_signals": [
      "The response changes or omits a decision-critical fact about preparing a survey export for analysis.",
      "Do not delete raw responses or treat free text as a numeric score.",
      "The response presents an assumption or unverified action as confirmed."
    ]
  },
  "provenance": {
    "origin": "synthetic",
    "authors": [
      "RealWorld Prompt Kit contributors"
    ],
    "contains_personal_data": false,
    "rights_basis": "original_project_authorship",
    "license": "MIT"
  }
}
