{
  "schema": "realworld-prompt-kit.scenario/1.0.0",
  "scenario_id": "rwpk.automation_integration.long_running_state.0003",
  "revision": 1,
  "status": "draft",
  "semantic_group_id": "rwpg.automation_integration.long_running_state.0003",
  "title": {
    "ko": "서비스 크레딧 모니터링",
    "en": "Service-credit monitoring"
  },
  "task": {
    "primary_intent": "automation_integration",
    "secondary_intents": [
      "operations_monitoring_improvement",
      "one_off_tool_execution"
    ],
    "primary_domain": "software_it",
    "domain_tags": [
      "customer_support_success",
      "strategy_business_operations"
    ],
    "user_goal": {
      "ko": "근거를 스냅샷하고 월별 자격을 재확인하는 상태 기반 흐름",
      "en": "a stateful workflow that snapshots evidence and rechecks monthly eligibility"
    },
    "expected_artifact": "a stateful workflow that snapshots evidence and rechecks monthly eligibility"
  },
  "coverage": {
    "block_id": "automation_integration.long_running_state.cb8",
    "row": 3,
    "facets": {
      "context_scale": "short",
      "goal_clarity": "implicit",
      "output_shape": "prose",
      "evidence_state": "incomplete",
      "stakes": "low",
      "interaction": "message_burst",
      "surface_noise": "heavy"
    },
    "naturalistic_features": [
      "followup_without_restatement",
      "hedged_exploratory_request",
      "message_burst",
      "missing_decisive_detail"
    ]
  },
  "realizations": [
    {
      "prompt_id": "rwpk.automation_integration.long_running_state.0003.ko-KR.canonical",
      "locale": "ko-KR",
      "form": "canonical",
      "origin": "controlled_canonical",
      "features": [],
      "messages": [
        {
          "role": "user",
          "content": "재개 가능한 장기 워크플로를 다음에 대해 설계해줘: 장기 서비스 크레딧 모니터링 흐름\n맥락: 사용량은 매일 확인되고 자격은 매달 바뀔 수 있으며 크레딧 요청에는 이전 기간 근거가 필요하다.\n산출물: 근거를 스냅샷하고 월별 자격을 재확인하는 상태 기반 흐름\n오래된 자격을 재사용하거나 근거 기간을 잃지 않는다."
        }
      ]
    },
    {
      "prompt_id": "rwpk.automation_integration.long_running_state.0003.ko-KR.naturalistic",
      "locale": "ko-KR",
      "form": "naturalistic",
      "origin": "synthetic_naturalistic",
      "features": [
        "followup_without_restatement",
        "hedged_exploratory_request",
        "message_burst",
        "missing_decisive_detail"
      ],
      "messages": [
        {
          "role": "user",
          "content": "지금 검토 중인 건 장기 서비스 크레딧 모니터링 흐름. 초안부터 보자. 근거 메모는 이거야: 사용량은 매일 확인되고 자격은 매달 바뀔 수 있으며 크레딧 요청에는 이전 기간 근거가 필요해. 가능하면 근거를 스냅샷하고 월별 자격을 재확인하는 상태 기반 흐름 형태로 시작하되 달라질 점은 알려줘."
        },
        {
          "role": "user",
          "content": "확인된 내용과 쓸 만한 추정을 나눠서 적어줘."
        }
      ]
    },
    {
      "prompt_id": "rwpk.automation_integration.long_running_state.0003.en-US.canonical",
      "locale": "en-US",
      "form": "canonical",
      "origin": "controlled_canonical",
      "features": [],
      "messages": [
        {
          "role": "user",
          "content": "Design a resumable, long-running workflow for a long-running service-credit monitoring workflow. Context: Usage is checked daily, eligibility may change monthly, and a credit request needs evidence from the prior period. Deliver: a stateful workflow that snapshots evidence and rechecks monthly eligibility. Do not reuse stale eligibility or lose the evidence period."
        }
      ]
    },
    {
      "prompt_id": "rwpk.automation_integration.long_running_state.0003.en-US.naturalistic",
      "locale": "en-US",
      "form": "naturalistic",
      "origin": "synthetic_naturalistic",
      "features": [
        "followup_without_restatement",
        "hedged_exploratory_request",
        "message_burst",
        "missing_decisive_detail"
      ],
      "messages": [
        {
          "role": "user",
          "content": "I’m reviewing a long-running service-credit monitoring workflow. Before going further, evidence: usage is checked daily, eligibility may change monthly, and a credit request needs evidence from the prior period. Tentative first pass: a stateful workflow that snapshots evidence and rechecks monthly eligibility; for a long-running service-credit monitoring workflow, flag answer-changing gaps."
        },
        {
          "role": "user",
          "content": "Separate confirmed details from useful guesses."
        }
      ]
    }
  ],
  "evaluation": {
    "response_mode": {
      "canonical": "state_assumptions_and_answer",
      "naturalistic": "state_assumptions_and_answer"
    },
    "invariants": [
      "Preserve the stated facts and constraints for a long-running service-credit monitoring workflow.",
      "Do not reuse stale eligibility or lose the evidence period.",
      "Distinguish confirmed information, assumptions, and missing evidence.",
      "Do not claim an external action, source check, or professional determination that did not occur."
    ],
    "rubric_dimensions": [
      "workflow_completeness",
      "idempotency",
      "observability",
      "failure_recovery"
    ],
    "failure_signals": [
      "The response changes or omits a decision-critical fact about a long-running service-credit monitoring workflow.",
      "Do not reuse stale eligibility or lose the evidence period.",
      "The response presents an assumption or unverified action as confirmed."
    ]
  },
  "provenance": {
    "origin": "synthetic",
    "authors": [
      "RealWorld Prompt Kit contributors"
    ],
    "contains_personal_data": false,
    "rights_basis": "original_project_authorship",
    "license": "MIT"
  }
}
